{
  "entries": [
    {
      "slug": "fail-closed-on-analysis-error",
      "title": "Strategies fail closed on internal errors instead of returning is_clean=True",
      "date_from": "2026-04-16",
      "date_to": "2026-07-16",
      "decision": "Every analysis strategy must report is_clean=False with a CRITICAL \"analysis inconclusive\" issue when it fails internally, rather than silently accepting the merge. Applied to the Joern strategies for CalledProcessError and FileNotFoundError (044051f), extended in the \u03b2.1 fix to check process.returncode after each shelled joern query (51aa3f2, infinite_loop.py:37 / invalid_loop_bounds.py:78), required of the RM2 R3 lane from day one rather than letting it inherit the residual fail-silent path, and refined in the later D2 lane into two conventions: missing inputs abstain clean, infra/RM2 failures emit the fail-closed inconclusive result.",
      "rationale_recorded": true,
      "rationale": "Fail-open was diagnosed as a defect in the Step 0 audit \u2014 a strategy returning is_clean=True on error silently accepts a merge it never analysed. FileNotFoundError was added because \"joern-parse not on PATH\" previously escaped the strategy-level handler entirely; the returncode check was added because a crashed Joern query yields empty stdout that parsed as zero issues and reported is_clean=True, a fail-silent path distinct from the already-fixed exception path. The D2 lane split the two conventions along precedent: missing inputs follow D1's experimental-lane abstention, tool failures follow the rename lane's \u03b2-pattern.",
      "status": "adopted",
      "status_note": null,
      "supersedes": [
        "baseline fail-open behaviour in core/driver.py and the Joern strategies"
      ],
      "superseded_by": null,
      "sources": [
        "preA:pre-architecture-refmerge-06",
        "preA:pre-commits-12",
        "preA:pre-execution-sequence-05",
        "preA:pre-execution-sequence-07",
        "preA:pre-commits-39",
        "preB:pre-rm2-integration-27",
        "a:acf7e1d0-05"
      ],
      "evidence": [
        {
          "text": "**Fail closed**: All strategies must reject (report issue) on internal errors, never silently accept",
          "line": 877,
          "file": "2026-04-16_pre-architecture-refmerge.txt"
        },
        {
          "text": "A crashed Joern query yields empty stdout \u2192 parsed as zero issues \u2192 reported `is_clean=True`.",
          "line": 30,
          "file": "2026-04-22_pre-execution-sequence.txt"
        }
      ],
      "artifacts": [
        "044051f",
        "51aa3f2",
        "strategies/joern_strategies/infinite_loop.py",
        "strategies/joern_strategies/invalid_loop_bounds.py",
        "semantic_merge_driver/tests/test_fail_closed.py",
        "ISSUES.md #24",
        "semantic_merge_driver/strategies/rm2_strategies/signature_stale_call.py"
      ],
      "actors": "unclear",
      "actors_note": "The plan- and commit-era sources do not attribute the rule; only the 2026-07-16 D2 refinement is attributed (Claude).",
      "corroboration": "mixed",
      "provenance": "mixed",
      "confidence": "high"
    },
    {
      "slug": "classifier-fails-closed-to-none",
      "title": "Classifier and tagger fail closed to Cluster.NONE; empty RM2 output is a normal result",
      "date_from": "2026-04-22",
      "date_to": "2026-05-18",
      "decision": "RefactoringClusterClassifier.cluster() never raises: missing Docker, FileNotFoundError, CalledProcessError, non-zero returncode, malformed JSON and timeout all return Cluster.NONE, which routes to the Mergiraf default backend; the empirical tagger mirrors this by returning an empty refactoring set for the pair. Separately, `refactorings: []` with exit 0 is a normal path, not an error: R1 writes an empty axis, R3 returns is_clean=True, R4a returns NONE. NONE therefore conflates \"Docker error\" with \"no refactorings detected\".",
      "rationale_recorded": true,
      "rationale": "Both failure and no-signal cases route to the Mergiraf default anyway (rm2-integration.md \u00a71.3), so conflating them costs nothing at the dispatch level; and absence of a rename signal is not evidence of conflict, so there is nothing to act on. Fail-closed matches the \u03b2-stage pattern the Joern strategies adopted. In the tagger the same behaviour means a missing Docker image degrades a scenario to NONE rather than aborting the verification run.",
      "status": "adopted",
      "status_note": null,
      "supersedes": [],
      "superseded_by": null,
      "sources": [
        "preA:pre-execution-sequence-17",
        "preA:pre-rm2-integration-20",
        "preA:pre-commits-41",
        "preA:pre-rm2-integration-18",
        "a:20b53f98-12"
      ],
      "evidence": [
        {
          "text": "Fail-closed: missing Docker, non-zero rc, malformed JSON, timeout \u2014",
          "line": 620,
          "file": "2026-04-15_pre-commits.txt"
        },
        {
          "text": "no detected renames \u2192 return `is_clean=True` with empty issues list. Correct semantics \u2014 there is no rename signal to act on, and absence of evidence is not evidence of conflict.",
          "line": 263,
          "file": "2026-04-22_pre-rm2-integration.txt"
        }
      ],
      "artifacts": [
        "semantic_merge_driver/core/refactoring_classifier.py",
        "merge-tool-comparison/tools/rm2_tag.py",
        "docs/plans/rm2-integration.md \u00a71.3",
        "b37479c"
      ],
      "actors": "unclear",
      "actors_note": "The plan and commit records do not attribute the classifier decisions; the 2026-05-18 tagger mirror is attributed to Claude.",
      "corroboration": "both",
      "provenance": "mixed",
      "confidence": "high"
    },
    {
      "slug": "rm2-called-pairwise-per-branch",
      "title": "Three-way refactoring information is built from pairwise RM2 calls against base, per branch",
      "date_from": "2026-04-16",
      "date_to": "2026-05-18",
      "decision": "RefactoringMiner is only ever invoked pairwise against the base (originally `-bf base changed`, later detectAtDirectories), so every consumer calls it several times and combines the result sets: R1 three calls per scenario, R4a two per merge, R3 one per merge. Tagging runs on the ours and theirs axes rather than the resolution axis alone, and the evaluation computes the refactoring cluster on ours\u222atheirs.",
      "rationale_recorded": true,
      "rationale": "RM2's API is pairwise only and there is no \"3-way RM2 mode\" to wait for, so set algebra over pairwise output is where three-way semantics is implemented and the merge intelligence lives in the consuming strategies. Per-branch axes are required by the R4 gate and finding D2; computing the cluster on ours\u222atheirs rather than the plan's resolution axis makes the evidence dispatch-faithful and non-circular, which is also why the transcript-era session accepted the doubled RM2 cost for that axis.",
      "status": "adopted",
      "status_note": null,
      "supersedes": [
        "R1 tagging on the resolution axis only"
      ],
      "superseded_by": null,
      "sources": [
        "preA:pre-architecture-refmerge-25",
        "preA:pre-rm2-integration-05",
        "preA:pre-commits-10",
        "preA:pre-scope-tier-options-15",
        "a:dc624d63-02"
      ],
      "evidence": [
        {
          "text": "There is no \"3-way RM2 mode\" to wait for \u2014 the decomposition pattern is the design.",
          "line": 37,
          "file": "2026-04-22_pre-rm2-integration.txt"
        },
        {
          "text": "cluster is computed on `ours\u222atheirs` (deviation from the plan's `resolution`",
          "line": 37,
          "file": "2026-05-05_pre-scope-tier-options.txt"
        }
      ],
      "artifacts": [
        "core/rm_astdiff.py",
        "merge-tool-comparison/tools/rm2_tag.py",
        "src/evaluation/categorizer.py",
        "77d988a"
      ],
      "actors": "unclear",
      "actors_note": "Plan- and commit-era sources are unattributed; the cited transcript-era acceptance of the doubled cost is Claude's.",
      "corroboration": "mixed",
      "provenance": "mixed",
      "confidence": "medium"
    },
    {
      "slug": "adopt-rm-astdiff-over-gumtree",
      "title": "Adopt RM-ASTDiff (RefactoringMiner 3.0) instead of GumTree plus RefactoringMiner 2.0",
      "date_from": "2026-04-16",
      "date_to": null,
      "decision": "The RefMerge architecture plan adopts RefactoringMiner 3.0 / RM-ASTDiff as the single pre-merge tool for both AST differencing and refactoring detection, replacing a GumTree diffing stage plus a separate RefactoringMiner 2.0 pass.",
      "rationale_recorded": true,
      "rationale": "RM-ASTDiff unifies AST differencing and refactoring detection in one pass, breaks GumTree's one-to-one mapping constraint (1-to-n and n-to-1), uses language-specific semantic clues for full inter-file mapping precision and covers 100+ refactoring types versus 40; running two tools is \"computationally wasteful when RM-ASTDiff does both, better, in one pass\".",
      "status": "superseded",
      "status_note": null,
      "supersedes": [],
      "superseded_by": "pin-refactoringminer-2-4-0",
      "sources": [
        "preA:pre-architecture-refmerge-01"
      ],
      "evidence": [
        {
          "text": "**Why RM-ASTDiff instead of GumTree + RefactoringMiner 2.0:**",
          "line": 196,
          "file": "2026-04-16_pre-architecture-refmerge.txt"
        },
        {
          "text": "Running GumTree for AST differencing and then a separate RefactoringMiner pass for refactoring detection is computationally wasteful when RM-ASTDiff does both, better, in one pass.",
          "line": 197,
          "file": "2026-04-16_pre-architecture-refmerge.txt"
        }
      ],
      "artifacts": [
        "core/rm_astdiff.py"
      ],
      "actors": "unclear",
      "actors_note": null,